<xs:schema xmlns:xs="http://www.w3.org/2001/XMLSchema">
  <xs:element name="employees">
    <xs:complexType>
      <xs:sequence>
        <xs:element name="employee" maxOccurs="unbounded">
          <xs:complexType>
            <xs:sequence>
              <xs:element name="Name" type="xs:string"/>
              <xs:element name="Phones">
                <xs:complexType>
                  <xs:sequence>
                    <xs:element name="Phone" maxOccurs="unbounded">
                      <xs:complexType>
                        <xs:simpleContent>
                          <xs:extension base="xs:string">
                            <xs:attribute name="Type" type="xs:string"/>
                          </xs:extension>
                        </xs:simpleContent>
                      </xs:complexType>
                    </xs:element>
                  </xs:sequence>
                </xs:complexType>
              </xs:element>
              <xs:element name="Addresses">
                <xs:complexType>
                  <xs:sequence>
                    <xs:element name="Address" maxOccurs="unbounded">
                      <xs:complexType>
                        <xs:sequence>
                          <xs:element name="Street" type="xs:string"/>
                          <xs:element name="BuildingNumber" type="xs:string"/>
                          <xs:element name="Region" type="xs:string"/>
                          <xs:element name="City" type="xs:string"/>
                          <xs:element name="Country" type="xs:string"/>
                        </xs:sequence>
                      </xs:complexType>
                    </xs:element>
                  </xs:sequence>
                </xs:complexType>
              </xs:element>
              <xs:element name="Email" type="xs:string"/>
            </xs:sequence>
          </xs:complexType>
        </xs:element>
      </xs:sequence>
    </xs:complexType>
  </xs:element>
</xs:schema>